{
  "spec_version": "v1",
  "schema_version": "1.0.0",
  "policy_version": "v1.0.0",
  "created_at": "2026-02-04T09:15:30Z",
  "capsule_id": "018f4b50-1b8c-7b3e-9b1a-9d7d3f0c5a55",
  "detectors": [
    {
      "id": "builtin-basic",
      "version": "1.0.0",
      "config_hash": "9f8e7d6c5b4a39219f8e7d6c5b4a39219f8e7d6c5b4a39219f8e7d6c5b4a3921"
    }
  ],
  "decisions": [
    {
      "path": "MEMORY.md",
      "decision": "include_encrypted",
      "class": "private",
      "reasons": ["allowlist"],
      "detector_hits": []
    },
    {
      "path": "memory/2026-02-03.md",
      "decision": "include_encrypted",
      "class": "private",
      "reasons": ["allowlist"],
      "detector_hits": []
    },
    {
      "path": "SOUL.md",
      "decision": "include_encrypted",
      "class": "private",
      "reasons": ["allowlist"],
      "detector_hits": []
    },
    {
      "path": "AGENTS.md",
      "decision": "include_encrypted",
      "class": "private",
      "reasons": ["allowlist"],
      "detector_hits": []
    },
    {
      "path": "projects/demo/STATUS.md",
      "decision": "include_encrypted",
      "class": "private",
      "reasons": ["allowlist"],
      "detector_hits": []
    }
  ],
  "findings": [],
  "findings_summary": {
    "total": 0,
    "by_class": {
      "public": 0,
      "private": 0,
      "sensitive": 0,
      "forbidden": 0
    },
    "by_decision": {
      "exclude": 0,
      "include_encrypted": 5,
      "include_redacted": 0,
      "include_plaintext": 0
    }
  }
}
