{
  "spec_version": "v1",
  "schema_version": "1.0.0",
  "policy_version": "v1.0.0",
  "created_at": "2026-02-04T08:00:00Z",
  "capsule_id": "018f4b50-1b8c-7b3e-9b1a-9d7d3f0c5a42",
  "detectors": [
    {
      "id": "builtin-basic",
      "version": "1.0.0",
      "config_hash": "b4a1d8c2e3f4a567b4a1d8c2e3f4a567b4a1d8c2e3f4a567b4a1d8c2e3f4a567"
    }
  ],
  "decisions": [
    {
      "path": "MEMORY.md",
      "decision": "include_encrypted",
      "class": "private",
      "reasons": ["allowlist"],
      "detector_hits": []
    }
  ],
  "findings": [],
  "findings_summary": {
    "total": 0,
    "by_class": {
      "public": 0,
      "private": 0,
      "sensitive": 0,
      "forbidden": 0
    },
    "by_decision": {
      "exclude": 0,
      "include_encrypted": 1,
      "include_redacted": 0,
      "include_plaintext": 0
    }
  }
}
